{
  "allowed_classifications": [
    "AVAILABLE_SIMULATOR_NATIVE",
    "AVAILABLE_CONDITIONAL",
    "AVAILABLE_CONTROL_ONLY",
    "MISSING",
    "AMBIGUOUS"
  ],
  "audit_scope": {
    "python_tree": {
      "file_count": 451,
      "root": "oph_fpe",
      "tree_sha256": "sha256:bf2a77a3d43397b55ffe3ac213b0abe0945860dc121c51ad4dfb35201deb9093"
    },
    "repository": "muellerberndt/oph-physics-sim",
    "scope_boundary": "bounded audit of the committed producer catalog and named artifacts; MISSING means no accepted producer in this snapshot, not a theorem that no future implementation can exist"
  },
  "capabilities": [
    {
      "adapter_promotion_allowed": false,
      "capability_id": "physical_quotient",
      "classification": "MISSING",
      "downstream_effect": "blocks every lane that requires the physical quotient",
      "label": "Physical quotient",
      "machine_check_ids": [
        "normal_form_checker_symbols",
        "source_quotient_hash",
        "source_replay_exact_nonconfluence"
      ],
      "machine_checks_passed": true,
      "missing_evidence": [
        "an attained applied normal-form or quotient certificate",
        "a stable semantic identifier for the required physical quotient",
        "external enumeration completeness",
        "identity with the paper's physical quotient"
      ],
      "producer_module_roots": [],
      "required_evidence": [
        "normal-form or quotient certificate",
        "stable semantic identifier",
        "physical quotient binding"
      ],
      "source_pin_ids": [
        "normal_form_checker",
        "finite_source_manifest",
        "finite_consensus_replay_report"
      ],
      "theory_binding_status": "NO_ATTAINED_PHYSICAL_QUOTIENT_CERTIFICATE",
      "verified_evidence": [
        "a generic finite normal-form checker exists",
        "one finite source state carries a gauge-quotient hash",
        "the pinned source replay fails its consensus theorem receipt and has two exact endpoint quotient classes"
      ]
    },
    {
      "adapter_promotion_allowed": false,
      "capability_id": "primitive_repair_law",
      "classification": "AVAILABLE_SIMULATOR_NATIVE",
      "downstream_effect": "supports finite internal-repair audits; cannot select physical collar dynamics",
      "label": "Primitive repair law",
      "machine_check_ids": [
        "bounded_repair_scope",
        "repair_projection_binding"
      ],
      "machine_checks_passed": true,
      "missing_evidence": [
        "A1-A3 uniqueness",
        "physical repair-law identification"
      ],
      "producer_module_roots": [
        "oph_fpe.dynamics.canonical_seam_repair"
      ],
      "required_evidence": [
        "code and configuration root",
        "transition replay artifact"
      ],
      "source_pin_ids": [
        "canonical_repair_producer",
        "bounded_repair_receipt",
        "record_counting_projection"
      ],
      "theory_binding_status": "FINITE_INTERNAL_REPAIR_NATIVE__PHYSICAL_LAW_OPEN",
      "verified_evidence": [
        "canonical internal-seam repair producer is pinned",
        "source projection and settled trajectory rows are pinned"
      ]
    },
    {
      "adapter_promotion_allowed": false,
      "capability_id": "boundary_sector",
      "classification": "AVAILABLE_CONDITIONAL",
      "downstream_effect": "local sector diagnostics only until the identity bridge exists",
      "label": "Boundary sector",
      "machine_check_ids": [
        "local_z6_sector_receipt",
        "global_sector_bridge_false"
      ],
      "machine_checks_passed": true,
      "missing_evidence": [
        "identity with the separate twelve-port global flux sector",
        "physical sector selection"
      ],
      "producer_module_roots": [
        "oph_fpe.local_domain.defect_sector_spectra"
      ],
      "required_evidence": [
        "exact sector representation",
        "quotient-visible readout"
      ],
      "source_pin_ids": [
        "defect_sector_producer",
        "defect_sector_receipt"
      ],
      "theory_binding_status": "FINITE_Z6_SECTOR_NATIVE__GLOBAL_IDENTITY_OPEN",
      "verified_evidence": [
        "finite local-domain Z6 character orbit is exact and source-pinned"
      ]
    },
    {
      "adapter_promotion_allowed": false,
      "capability_id": "scalar_register",
      "classification": "MISSING",
      "downstream_effect": "blocks CR-3 and the native cocycle lane",
      "label": "Scalar register",
      "machine_check_ids": [
        "typed_scalar_section_only"
      ],
      "machine_checks_passed": true,
      "missing_evidence": [
        "selected scalar register ID",
        "scalar projector",
        "scalar spectral-isolation interval"
      ],
      "producer_module_roots": [],
      "required_evidence": [
        "source-defined scalar register semantic ID",
        "projector",
        "spectral isolation witness"
      ],
      "source_pin_ids": [
        "stage3_receipt"
      ],
      "theory_binding_status": "NO_NATIVE_COMMON_RESERVE_SCALAR_REGISTER",
      "verified_evidence": [
        "a two-dimensional typed scalar section exists on the local domain"
      ]
    },
    {
      "adapter_promotion_allowed": false,
      "capability_id": "protected_z6_reserve",
      "classification": "MISSING",
      "downstream_effect": "blocks CR-2 and every reserve-consuming reduction",
      "label": "Protected Z6 reserve",
      "machine_check_ids": [
        "z6_is_sector_not_reserve",
        "total_twelve_is_not_z6_reserve"
      ],
      "machine_checks_passed": true,
      "missing_evidence": [
        "primitive protected-reserve field",
        "reserve opportunity records",
        "count/presence/absence/first-hit separation"
      ],
      "producer_module_roots": [],
      "required_evidence": [
        "primitive reserve state field or exact derivation from center-sector data",
        "separate count, presence, absence, and first-hit semantics"
      ],
      "source_pin_ids": [
        "defect_sector_receipt",
        "bounded_repair_receipt"
      ],
      "theory_binding_status": "NO_NATIVE_PROTECTED_RESERVE_OBJECT",
      "verified_evidence": [
        "an exact finite Z6 sector family exists",
        "a protected total-twelve load diagnostic exists in another domain"
      ]
    },
    {
      "adapter_promotion_allowed": false,
      "capability_id": "scalar_reserve_coregistration",
      "classification": "MISSING",
      "downstream_effect": "blocks every cross-lane common-parameter claim",
      "label": "Scalar/reserve co-registration",
      "machine_check_ids": [
        "parents_do_not_supply_coregistration"
      ],
      "machine_checks_passed": true,
      "missing_evidence": [
        "native scalar register",
        "native protected reserve",
        "co-registration derivation and witness"
      ],
      "producer_module_roots": [],
      "required_evidence": [
        "same-source scalar/reserve derivation rule",
        "event-level co-registration witness"
      ],
      "source_pin_ids": [
        "defect_sector_receipt",
        "stage3_receipt"
      ],
      "theory_binding_status": "NO_NATIVE_COREGISTRATION_RULE",
      "verified_evidence": []
    },
    {
      "adapter_promotion_allowed": false,
      "capability_id": "source_ensemble_action",
      "classification": "AVAILABLE_CONTROL_ONLY",
      "downstream_effect": "may be run as a separately reported control; blocks native screen statistics",
      "label": "Source ensemble/action",
      "machine_check_ids": [
        "reference_ensemble_explicitly_e1_control"
      ],
      "machine_checks_passed": true,
      "missing_evidence": [
        "OPH-native ensemble selector"
      ],
      "producer_module_roots": [],
      "required_evidence": [
        "exact measure or action",
        "sampling law",
        "OPH-native source selection"
      ],
      "source_pin_ids": [
        "reference_ensemble_producer"
      ],
      "theory_binding_status": "CONVENTIONAL_E1_CONTROL__SOURCE_SELECTION_OPEN",
      "verified_evidence": [
        "the conventional E1 free-scalar control has an explicit action and sampling law"
      ]
    },
    {
      "adapter_promotion_allowed": false,
      "capability_id": "refinement_tower_physical_scale_ratios",
      "classification": "MISSING",
      "downstream_effect": "keeps issue 657 at SOURCE_PRODUCER_MISSING",
      "label": "Refinement tower with physical scale ratios",
      "machine_check_ids": [
        "charged_response_refinement_symbols",
        "finite_two_scale_sector_rows"
      ],
      "machine_checks_passed": true,
      "missing_evidence": [
        "physical scale-ratio binding",
        "one common refinement lineage joining the common-reserve objects",
        "quotient-state and observable-algebra refinement maps",
        "one commuting bi-refinement square for the selected scalar covariance"
      ],
      "producer_module_roots": [],
      "required_evidence": [
        "fine/coarse maps",
        "common lineage",
        "commuting-square evidence",
        "physical scale ratios"
      ],
      "source_pin_ids": [
        "charged_response_producer",
        "defect_sector_receipt"
      ],
      "theory_binding_status": "NO_COMMON_PHYSICAL_BIREFINEMENT_TOWER",
      "verified_evidence": [
        "exact twelve-port persistence maps exist on a geodesic tower",
        "finite local-domain observations exist at two carrier counts"
      ]
    },
    {
      "adapter_promotion_allowed": false,
      "capability_id": "support_geometry",
      "classification": "MISSING",
      "downstream_effect": "blocks CR-5 geometric screen production",
      "label": "Support geometry",
      "machine_check_ids": [
        "local_atlas_partial",
        "counting_measure_partial"
      ],
      "machine_checks_passed": true,
      "missing_evidence": [
        "common-reserve support map",
        "screen mass matrix",
        "source-native J_X input"